Course,Campus,Term,Section,Invited,Responded,Mean1,Mean2,Mean3,Mean4,Mean5,Mean6,Q9 mean,Q10 mean,Q11 mean,Median1,Median2,Median3,Median4,Median5,Median6,Mode1,Mode2,Mode3,Mode4,Mode5,Mode6,StdDev1,StdDev2,StdDev3,StdDev4,StdDev5,StdDev6,A2,C2,D2,D4,E1,E2,E3,Comment for Q7,Comment for Q8
JRE420H1,UTSG,Summer_2014,LEC0101,48,20,3.5,3.6,4,3.5,3.4,3.4,4.8,3.6,4.7,4,4,4,4,4,4,3,4,5,"4,",4,4,1.2,1.1,0.9,,1.4,1.3,N/A,N/A,N/A,N/A,N/A,N/A,N/A,"b""It was good.The professor is one of the best I've had un my three years of undergrad at U of T. She creates a friendly atmospherein class, and is very good at condensing the material into manageable lectures that are stimulating and not energydraining or boring. Both TA's I had a positive experience with, however Anny led my tutorial so i'll primarily talk about her. She's veryengaged in the subject matter and appears to be genuinely interested during tutorial. As a result, she stimulatesreally good class discussions. She has excellent dominance over the material and is great at exemplifying its realworld use. One of THE best TA's I've had in my undergrad as wellAs a final note, both the TA's and the professor were always concerned with us bettering ourselves constantly duringthis course. They really wanted us to excelI thought the course was taught very well. The instructor structured each day of lecture to be 1/3 listening to thelecture and the other 2/3 actually applying what was discussed in the first 1/3 of the class. This kept the courseinteresting for me because it was not just sitting listening to 3 hours of lecture; we were actually learning by doing,which kept in interested in the course material.the instruction in this course is very clear and straightforward. The instructors would clarify the material as soon aspossible once there was misunderstanding.Less emphasis needs to be placed on research - more emphasis needed on negotiating and conflict resolution.It was goodCombination of lecture note and role play does help me apply things we learned to the activity and it makes materialmore interesting.The instructor went into depth in each of the assignments - what was required and how it should be presented(explaining in class). This was very helpful.The role-plays were very interesting and I was able to meet new friends. This course is very different compared toengineering courses.The instructor was okthe slides were sometimes very unclear, they lacked logical flow, important variables were often not defined justexamples were given, your method of explaining studies on slides were weirdI highly disliked these projects. The instructions for both were incredibly unclear, it was hard to understand what youwere asking, there were so many details about what you wanted scattered all over the place, the majority of the timefor both projects was spent on figuring out what this project was asking of usThe projects also seemed unrelated to this corse. As a engineering business course we want to know the subjectmaterial, we want to know how it applies to us and ways to become better leaders. And the lecture materialsdefinitely provided that but the projects did not. The projects were just learning how to do research and statisticalreferences and if we were actually majoring in organizational behaviour then learning how to read and interpret andcreate these kinds of studies would be very important to our studies. However no one in this course is looking tomajor in organizational behaviour or psychology or anything like that. We are simply engineering students who wantto take the information and studies that organizational behaviour students and researchers have conducted and put itto practical use. so for future courses it would be better for this particular course to be more learning about thematerial and how to apply it rather then doing research and studies.8. Please comment on any assistance that was available to support your learning inthis course.""","b'CommentIt was good, prof was available every class an hour earlier than usual if any help was needed.No assistance was necessary.tutorial (role play exercise, team discussion), very creative. extra assistance also available from Prof?TA via email.TA - Anny Fong was extremely helpful. The Prof was really supportiveOverall the assistance was great   PEOPLE MGMT. & ORG. BEHAVIOUR JRE420H1-LEC0101 - Phanikiran Radhakrishnan - 20/06/2014 5/13There was a lot of assistanceThe office hour before lectureThe tas were very lively and engaging however they sometimes seemed as if they didnt know what the prof wantedeither.'"
MGT1160H,,Fall_2019,LEC0101,75,52,2.4,2.3,2.7,2.5,2.5,2.1,4.8,3.6,4.7,2,2,3,2,2,2,"2,3",1,3,2,2,"1,2",1.1,1.3,1.3,1.2,1.3,1.1,N/A,N/A,N/A,N/A,N/A,N/A,N/A,"b""So much blank time during classOverall, the instruction is clear.The course was not very helpful and the quality of instruction was very poor. Instructor was not familiar with the subject matter of themock case and was not even present for our mock case and case comp presentations. The only useful part of the course was themock case, which could have been covered in another course instead. Overall our time and energy would have been better spenton our many other courses instead of having MGT1160 at all. I do not feel that I have learned anything from the instructor or thiscourse overall.Lots of work, but not helpful, in the sense that they are not deep but they just add to our workload. The professor doesn\xe2\x80\x99t offer muchinsight during lectures and lecture hours were mostly assigned for us to discuss, which mostly end up with pointless small talks.The professor\xe2\x80\x99s lecture lack charisma and much concrete knowledge that can help us. The presentations made we feel bad aboutour communications skills without offering an effective way to help improve them. The professor never got back with our scores forassignments that we put in much work, such as a self recorded video about values (of which the topic was very generic andirrelevant to our program of studies.) This course overall provides unnecessarily heavy workload on top of our already heavytechnical course load, a few hours every week on average to listen to lectures with no charisma and little help on communicationskills.It\xe2\x80\x99s fine but it\xe2\x80\x99s just a waste of time in such an intensive semesteruselessIn terms of the mock case write up, the instructions were very vague and communication was rather poor from the TAs as to whatwas required.noDisorganized class. Recommend to make it more structuredI honestly cannot believe that we pay this much in tuition for a course of this quality. Absolutely the worst class i ever have ever takenI felt lectures were very unstructured. Classes felt like a free\xe2\x80\x93for\xe2\x80\x93all. Very low attendance rates. Lacked communication about whatwould be covered in the class. We would start out class with no guidance\xcd\xbe I found myself asking the TA what we were supposed tobe doing as everyone was waiting for instruction on how to proceed.goodThis instructor did NOTHING HELPFUL!!! Every class she came in giving out candies and then sat somewhere at the back rowsdoing nothing. She is the WORST teacher I have ever met so far!!! An extremely terrible learning experience in her classes!the professor has no understanding of accounting, she cannot help us with the case she provided us.The instruction is integrative but too complex and time consuming. Moreover, it is not majorly communication\xe2\x80\x93focus. Feedbackshould be given more promptly.goodIt motivates teamwork.I cannot say enough how useless this course is in such an intensive program. It's not only taking up a large amount of time, but it'salso helpless and pointless. I don't see any point in having this time\xe2\x80\x93consuming course since nobody's communication skills areimproved.This course was absolutely unnecessary. I learnt nothing, it was not structured and feedback came relatively slow. Most classeswas pointless since we did nothing. Our questions were not being answered effectively. It\xe2\x80\x99s titled as communication but little wasdone to improve actual speaking skills. It started out well but when it got to the middle there was nothing left to do. So this courseshould be a one day workshop not a course.I don't think it is necessary to learn such a course during MMPA programIt improves students' presenting skills but it's not a practical coursevery goodI think this course is meaningless. The professor just handout the material of mock cases, and all time left is for discussion. I gainnothing from both the courses and from the professor's teaching. I think this course should be cancelled or should be redesigned. Ithink the professor should teach some useful expressions and words to improve communication ability for international students.Moderate.I cannot see any preparation from her class. For a lot of classes, she just let us discuss by ourselves which is a waste of time andmy tuition.Good instructor have comprehensive knowledgeRadhakrishnan_Phanikiran_MGT1160H_COMMUNICATIONS MGT1160H-F-LEC0101_12/6/2019 4/168. Please comment on any assistance that was available to support your learning in this course.Comments""","b""create more activitiesTAs often help us understand the topics.Feedback on presentations is available. Other than that not much.TAs are fine but some of them never showed upnoneTAs were available but not as helpful as needed.noSomewhatShe should be fired immediately!!!naIt's OK.Questions were being answered vaguely by the TAs and the professor.Classes were hold for group discussion was goodvery goodN/Ateach us more communication skills not just let us chat each class....Too much workolad."""
Negotiation Skills,UTM,Fall_2015,LEC0101,39,20,3.1,3,3.2,3,2.8,2.9,4.8,3.6,4.7,3.5,3.5,3,3,2,3,4,1,"3,5",3,2,"1,4",1.5,1.7,1.5,1.4,1.4,1.5,N/A,N/A,N/A,N/A,N/A,N/A,N/A,"b'Did not learn much about negotiation.interesting course material, loved the negotiatingThe Prof is knowledgeable. Her layout of the class is good. sometimes micromanages.I HATED this course. It was the most useless thing I have ever taken It was a waste of my 16k tuition. The structure, theprof and everything about this course was a complete waste of my time. I would not recommend this course to anyone. Whoever makes the decision to hire profs and design courses should seriously either get rid of this course or find aprof who can actually teach. It was 100% a waste.The professor was not helpful at all. This entire course was self taught with little to no instruction from the professor.Anytime I asked her a question in class or during office hours she did not clarify anything but instead was verycondescending and said, ""This is so easy; you should know"". She also refused to remark midterms or even speakabout them if someone felt the mark should be higher.Every case felt like it was the same thing over and over again. Didn\'t understand a lot of the conceptsNo structure given, seems like the lessons were done on the fly.Overall quality was great.The instruction, when it happens is good. I feel like we were left to do our thing and there was very little guidance oractual instruction. We would have in class negotiation sessions then sometimes not have a debriefing. So, we endedup gaining a lot of practical skill and very little ""knowledge"" or ""terms"". And then in the midterm that is what we gradedon, not the practical knowledge. Very annoying.I found that lectures weren\'t clear and that there was no clear objective with the lesson plans. They were not direct and Ileft with confusion about the subject matter.disorganized and hard to understand assignments, what is expected, etc.Taught wellInteresting class structure. Appreciated the hands-on negotiation we got to doVery much what i expect from a university-level course. Professor is excellent. The professor isn\'t shy about beingpersonable (which is rare and great). Professor encourages student participation and manages it well. TA was anunfair marker and the grading scale/weighting of the midterm was very confusing.8. Please comment on any assistance that was available to support your learning in thiscourse.'","b'CommentShe was available mostly in class.No assistance at all. When asking for help the prof just embarrasses you and in front of everyone and doesn\'t provideany help... I still don\'t know what I\'m paying for.. The prof isn\'t even going to be at the exam....There was no assistance. The professor didn\'t even assist my learning. Everything was self taught and the professordidn\'t even clarify and questions we had.The TA was very nice and responsive but wouldn\'t really address questions asked. Instructor would say ""refer to myslides"" when any question was asked or ""I mentioned this in class"" but no further clarification was given.Professor did a great job at responding back to my emails and providing support.None.Office hours`'"
JRE420H1,UTSG,Winter_2018,LEC0103,46,14,3.7,4,4.3,4.1,4.1,3.9,4.8,3.6,4.7,4,4,4,4,4,4,"3,4",4,"4,5",4,4,4,0.9,0.9,0.7,0.7,0.7,0.8,N/A,N/A,N/A,N/A,N/A,N/A,N/A,"b'Clear, easy to follow instructions. Everything had a clear goal and purpose which makes me motivated to follow them.Instructor was always very well prepared, and activities were very relatable to what we were learning. Amazing structureto the course.niceI liked the way Professor taught the course, it is a very practical way of learning. This course is not about memorizing. Ithink maybe this course will be the one I would remember more. It was very practical, the activities, and journals. I likedwe always tried to connect real life with the theories and concepts.Well designed lectures, interactive with class. Examples, activities in class, weekly journals were helful to understandtopics.Sometimes felt as though I was being talked down toIt would be better if we could use computers to type our answers for midterm and final exams.Instruction method was good with class activities, lecture slides, and roleplays. Would recommend that the testingmaterial and assignment sheets be better flushed out and detailed. There were many details that also had to beclarified during the midterm and assignment (ex. What insights doe the theory provide?). Recommend to make moreexplicit in questions (ex. what do you mean by insights). Also please put due date on assignment handout rather thanjust blackboard submission link and clearer rubrics. Currently have checklist of items to include but if everything ischeckmarked is this a full marks. On individual assignment there was a sliding scale but there was little detail as towhat constituted the lowest mark vs highest possible mark in the scale other than prompting questions. Also if a studyis introduced there are many limitations to them, would be good to introduce these limitations so we can keep them inmind when looking at the results. Some of the course material and textbook make general statements too much (ex.statement in textbook that undergraduates are full of confidence/too confident, seniors are not hired much). Forexample, in the second statement, this might be true for some jobs but not highly specialized jobs (ex. surgeon,anesthesiologist) which should be taken into account when saying these statements and because we are mostlyexposed to these jobs as undergraduate engineering students.Classes were very good and learning through activities was enjoyable. Group project was too theoretical. It would havebeen nice if that was a little more applied as well.The prof uses lots of real life experience to make a deeper understanding of concepts to me and I found that they arevery useful, and let me understand more on real life behaviorOverall good8. Please comment on any assistance that was available to support your learning in thiscourse.'","b""CommentsInstructor replied to emails very quickly, TA's were very helpful always.Professor was readily available before and after class and by email.They are nice!!Overall goodPEOPLE MGMT. & ORG. BEHAVIOUR JRE420H1-S-LEC0103 - Phanikiran Radhakrishnan - 4/11/20184/17   Part B1. Divisional Items"""
Organizational Behaviour,UTM,Fall_2016,LEC0102,49,31,3.1,3.4,3.5,2.7,3.1,3,4.8,3.6,4.7,3,4,4,3,3,3,4,4,5,4,4,3,1.1,1.2,1.3,1.3,1.2,1.1,N/A,N/A,N/A,N/A,N/A,N/A,N/A,"b'The instructor taught this course differently from other professors. There was a lot of interaction and discussion withinthe classroom which I found to be beneficial.The quality of the instruction and the course was partially good as the instructor was enthusiastic, however the actualcontent was somewhat basic knowledge and repetitive, simply talking about 5 main skills managers need. In addition,the assignment instructions were already unclear, the assignment was boring and tedious, it was not mentallychallenging nor interesting. The course revolved around skills an individual acquired, and did not lead into anythingnew over the time period. Much of the content was similar to psychology and not really going in depth aboutmanagement itself, more about people personally. The majority of the lectures were just discussion that the teacherwas asking, not necessarily relating to the textbook or learning anything new, instead we were just analyzing our ownskills.- Intersting and funny exercises in class but did not contributed to understanding the material better- Course material not really covered in class- Lecture slides, material and syllabus disorganized (material from last year, changing course outline) ->- Disorganization and the lack of leadership seems to be repetitive occurring problem with courses in the managementdepartment -> Examples: Bailey\'s disastrous Eco100 courses and STA 218 in fall 2016 to name just a few- Assignments announced too late to make any meaningful contribution to this subject- Use of inappropriate language -> For example the words ""retarded teenager"" was used in one example for ourhomeworkVery informative professor, patient and helpful.badfineThe overall atmosphere of the class was fun and interacting.Professor R was amazing! I feel a deeper understanding of what I want to do with my life, and just a general direction ofmy career after taking this course, so I owe her.Every lecture was interesting, and actually had so many practical workplace skills. This course and Professor R areESSENTIAL to the Commerce program.very engaging, I learned a lot from the activities provided in classNice instructor and very helpful.It was good, lectures were engaging and informativeI thought I took PSY100 once again but with a different course code. Basically, the content of the course consists of 3-4chapters from PSY100. Although I liked the professor and her warming personality, the course content was awful. Iwould not recommend this course to anyone who took PSY100, and for those who haven\'t taken it I would definitelysuggest to take Psychology instead.This is an course require high involvement .Good.She is greatinstructions were vaguegood professor really interestingI learned a lot through this course.8. Please comment on any assistance that was available to support your learning in thiscourse.'","b'CommentThe professor helped at times answering questions at the beginning or end of class. However she was always veryunclear about many things concerning the subject matter and any assignments. In addition, I emailed the TA regardinga poor mark that I received because I was shocked because I worked efficiently and put a lot of time and effort into myassignment answering all the questions. The TA said she ""once you review the comments, you may submit for a re-grade\' although she never followed up, there was never an announcement on blackboard, nor an area created to re-submit my assignment.   Ind & Group Behaviour in Org Organizational Behaviour-F-LEC0102 - Organizational Behaviour - Phanikiran Radhakrishnan - 12/5/2016 6/12no assistancea little bit helpProfessor has office hours that are quit available to everyoneShe help office hours.Office hoursvideo provided by instructorThere was not so much assistance, although the professor was open for any help.Textbook.office hours were useful, TA not very useful'"
JRE420H1,UTSG,Fall_2018,LEC0103,53,14,3.9,4,4.1,3.7,3.9,3.6,4.8,3.6,4.7,4,4,5,4,4,4,5,4,5,"4,5",5,5,1.3,1,1.5,1.4,1.1,1.5,N/A,N/A,N/A,N/A,N/A,N/A,N/A,"b""Please fix your PowerPoint slides! They are dull, messy, and uninteresting. There are grammatical errors and the content is oftenquite confusing.This course was generally very good. The in class activities are okay in terms of (how long it takes vs. the lesson we learn from it),although it is a nice break during a 3 hour lecture. A criticism is that some material is covered way too quickly and must be actuallylearned later by reading the textbook. It's evident that Dr. R and the TA's care about the course and providing an interactive learningenvironment. Less in\xe2\x80\x93class time should be dedicated to the group presentation (or should at least be covered during tutorial time). It was usefulinformation, but working on it during class was ineffective for our teamSO BORING...... extraordinarily poor learning atmosphere as the class wasn't engaging at allThe classes were very interesting and the class activities and exercises were exciting and simulating. The coursework wasn\xe2\x80\x99t veryheavy but the midterm was corrected very harshly.Professor is very nice and passionate about the course. She is very knowledgable and pleasant. 4 hours of the course on a Fridaynight made it hard to stay engaged the entire lecture.The instructor is fair. She just read the slides during the class.The use of interactive role plays made this course incredible. I have used so many of the concepts learned in my life. Absolutelyloved itI liked this course. The written assignment could be a bit more fun and engaging.The quality of the instruction of the course is good, just that the material was always rushed and did not cover the whole chapter.Often, the lecture only touched on a few aspects of the chapter, leaving students to learn the rest by themselves. Material that wouldbe covered on the midterm should be identically covered in lecture, leaving no need for the students to go home and learn themajority of the chapters on their own.Prof Radakrishnan is a very knowledgeable professor and she can make sure students learn the correct information by havingdiscussions in class. Students and the professor feel very confident to question each other and this way the course material ispracticed. She gives real life examples whenever she gets the chance.8. Please comment on any assistance that was available to support your learning in this course.Comments""","b""Dr. R gives students lots of opportunities and means to contact her. She's very responsive and even called me to answer a questionbefore the midterm.Professor was always available to provide assistance.Professor and TAs were always very helpful and friendly.TA is pretty good at assisting projects or course contents.Great support! TAs were quite friendly!The TAs were very helpful and open to discussion too.Radhakrishnan_Phanikiran_JRE420H1_PEOPLE MGMT. & ORG. BEHAVIOUR JRE420H1-F-LEC0103_12/5/2018 4/17Part B1. Divisional Items"""
