Course,Campus,Term,Section,Invited,Responded,Mean1,Mean2,Mean3,Mean4,Mean5,Mean6,Q9 mean,Q10 mean,Q11 mean,Median1,Median2,Median3,Median4,Median5,Median6,Mode1,Mode2,Mode3,Mode4,Mode5,Mode6,StdDev1,StdDev2,StdDev3,StdDev4,StdDev5,StdDev6,A2,C2,D2,D4,E1,E2,E3,Comment for Q7,Comment for Q8
Organizational Behaviour,UTSC,Fall_2019,LEC02,63,17,2.8,2.8,2.9,2.5,2.4,2.3,2.3,3.3,2.6,3,3,3,2,2,2,2,2,"3,4",2,2,3,1.2,1.1,1.1,1,0.9,0.9,N/A,N/A,N/A,N/A,N/A,N/A,N/A,"b""I am lost in the class.Prof. Phani's lecture content was all over the place. I assume that she has not changed her teaching style over the past years. It wasreally frustrating following the concepts during her lectures, I became unmotivated to come to class because I did not understandher teaching, so I relied heavily on self\xe2\x80\x93study. I did not enjoy having to present in front of a camera, I did not consent to be filmed forthe group presentation and having it available to the rest of 80 students. This course was really frustrating to handle.Professor R clearly demonstrated her knowledge and expertise in organizational behavior. For the most part, the class atmospherewas very open to discussion which helped facilitate learning. I would have liked to see more supplemental work to help solidify theconcepts we learned (e.g. weekly practice questions). The midterm questions were also very ambiguous in their wording whichmade it hard to demonstrate that I understood the concepts presented in class. That being said, overall Dr. R was a great profThe instructor does not listen to students' questions and opinions. The professor only cares that every student needs to take in heropinion. Although she pretends to encourage everyone to speak in the class, she often just refute the student and say that it's justsupposed to be what she says in the class. She also does not give clear instructions for any assignments. The grading ofassignments is also graded by very generalized scales and the feedback often has criteria that were not in the task description. Shewanted us to tasks that she believe is useful for the career, but the fact that she is super restricted towards everything just killed anypossibilities. Everything happened in this course was a huge confusion. The main reason is due to the professor. She even suggested one of my friends in dropping the course. I believe this is not what Iwanted for in such a high ranked university. I highly regret taking this course with this professor. I believe my first exposure to theHuman Resources stream could be made better if it is taught by other professors. Now, I just hate human resources and killed allmy interests in going into this stream. I hope no one needs to suffer through this instructor again.The quality of the course is good.Instruction was good. Professor was always there when there was needed extra explaining.I was treated like an elementary school child\xe2\x80\x93 Teaching style was helpful, but at times inconvenient\xe2\x80\x93 Weekly reflections were useful for extra credit\xe2\x80\x93 Content could've been delivered in a more organized mannerI kinda don't get the point doing the assignment or the presentation. The teaching on how to do the assignment was grosslyinadequate. Also more simple slides!!!!it was clearThe instructor tries to encourage students to participate in group activities and encourages new ways of learning in the class, butshe is not at all clear with her instructions. The more she tries to explain and clear doubts the more confusing it gets to understandwhat we need to do.8. Please comment on any assistance that was available to support your learning in this course.Comments""","b""Professor's video call.I relied mostly on self\xe2\x80\x93study because there is no way in determining that my answers for journal and reflections were correct. Shegave hints during lectures in answering questions on her slides but did not provide a distinct answer, for actually understanding theconcept. I was very confused most of the time, it was terrible. Due to time constraints and an extremely busy schedule, I could notspeak to her in person. I would have prefered if she talked about the answers to the questions she posted on the slides during thelecture.On the course description, TA was supposed to host OH ofter assignment was handed back, but that never happened.The course material can be describe more clearly by the instructor and assistance.Assistance was always available and the lecture material was always posted online.Office hoursN/An/acould be more organizedThe course does not have any tutorials, but the professor is more than happy to help in any assistance."""
Negotiation Skills,UTSC,Fall_2017,LEC30,12,7,4.6,4.6,4.6,4.3,4.1,4.3,4.3,3.4,4.3,5,5,5,5,5,5,5,5,5,5,5,5,1.1,1.1,1.1,1.1,1.2,1.1,N/A,N/A,N/A,N/A,N/A,N/A,N/A,"b'No clear grounds for what will be tested on the exam or what is expected out of the studentGreat course, interesting content, easy works, challenging open\xe2\x80\x93ended questions, connected to real life. This is theBEST course i have taken in UTSC so far.Great class! amazing professor, made the course really enjoyable.Really great, the weekly role plays were extremely beneficial to my learning as were the subsequent lectures.8. Please comment on any assistance that was available to support your learning in thiscourse.'",b'CommentsThe course load excessively high with no learning objectiveWe had an outside guest speaker came to our lecture once. was interesting and helpful.Reading materialsEmail.Business Negotiation Negotiation Skills-F-LEC30-Phanikiran Radhakrishnan-12/4/20174/15   '
Leadership Skills,UTSC,Winter_2013,LEC03,[],[],4.6,4.6,4.6,4.3,4.1,4.3,4.3,3.4,4.3,N/A,N/A,N/A,N/A,N/A,N/A,N/A,N/A,N/A,N/A,N/A,N/A,N/A,N/A,N/A,N/A,N/A,N/A,N/A,N/A,N/A,N/A,N/A,N/A,N/A,"b""b'No clear grounds for what will be tested on the exam or what is expected out of the studentGreat course, interesting content, easy works, challenging open\\xe2\\x80\\x93ended questions, connected to real life. This is theBEST course i have taken in UTSC so far.Great class! amazing professor, made the course really enjoyable.Really great, the weekly role plays were extremely beneficial to my learning as were the subsequent lectures.8. Please comment on any assistance that was available to support your learning in thiscourse.'""","b""b'CommentsThe course load excessively high with no learning objectiveWe had an outside guest speaker came to our lecture once. was interesting and helpful.Reading materialsEmail.Business Negotiation Negotiation Skills-F-LEC30-Phanikiran Radhakrishnan-12/4/20174/15   '"""
Compensation,UTSC,Fall_2018,LEC01,8,4,3.5,3.3,3.8,3.3,3.3,3,3.3,3.5,3.3,3.5,3,4,3,3,3,"2,3,4,5",2,5,2,2,"1,2,4,5",1.3,1.5,1.5,1.5,1.5,1.8,N/A,N/A,N/A,N/A,N/A,N/A,N/A,"b'The overall quality of the instruction in this course is truly phenomenal. You can tell Professor Radhakrishnan demonstrates apassion for teaching and inspiring her students to reach their full potential. Providing relevant real world examples to the materialshe teaches. Going above and beyond to exceed expectations as a ""typical"" university professor. One of the very few classes that Igenuinely enjoyed attending and looked forward to week over week. Working full time and continuing my post secondary educationpart time really takes a toll on you physically and mentally but she really makes the learning experience enjoyable! \xe2\x80\x93RajinKalatharan8. Please comment on any assistance that was available to support your learning in this course.Comments'","b'Office Hours, In\xe2\x80\x93Class, WebOption, Adequate time for Assignments/Projects'"
Organizational Behaviour,UTSC,Fall_2017,LEC03,60,15,3.3,3.5,3.6,3.2,3.1,3.2,3.3,3.2,3.4,3,3.5,4,3,3,3,3,3,4,3,"3,","3,4",1.1,1.2,1.2,1.1,,1.2,N/A,N/A,N/A,N/A,N/A,N/A,N/A,"b'instruction was moderately clear most of the timegoodShe was great!Very fast\xe2\x80\x93paced and students aren\'t ever given feedbackThe assignment did not teach me anything. If i wanted to learn how to read a journal, which I already do, i would takethe course about literacy. The assignment and the presentation were the same thing being read a journal andsummarize your findings. None of this taught me anything about managing people and groups in organizations. Sure,the lecture were somehow applicable but the professor only want the answers to be provided her way. ""Comparecontrast personality and attitude"" How is one even supposed to answer to that? I swear all of my classmates wereconfused and I never heard anyone say anything good about this. She made this dumb exercise about managing people and ask students to give her 1$ which I heard some kids didn\'tget it back from some other lectures. 1. don\'t get money involved, this is a university. 2. it started getting pretty big of afight and people yelling at each other and someone literally came to me and said ""I want to throw a chair at this person""The prof was there, did she intervene to ensure everyone stays calm? no. She just let it escalate. Honestly sure she\'s good a teaching but making a curriculum and planning lectures, shes the worst, She doesn\'t gothrough all of her slides and is a little messy. Don\'t let her write the curriculum or assignments anymore. I don\'t knowanyone who learned something from that dumb assignment and presentation. First thing she does when she comes in lecture is brag about herself and assumes that everyone is in management.Does she know her course is a program requirement to other unrelated programs? My friend is in computer scienceand all she says in class all day long "" we are all management students and want to be CEO\'s right? "". The only thing she did that was good was lead the lectures and i will be honest shes good at explaining concepts butreally, this was by far one of the worst profs I have ever seen. Let me talk about this journal thing. Every end of lecture we have to answer some questions that she gives in class. Andhonestly, why are we even doing that? She answers them in class. She assumes everyone has a computer and willbring a computer to class. Does she knwo how heavy a computer is? And I don\'t have time to go take a picture, send itto my facebook, go to library, download the picture, upload it to the journal entry and send it. If she really wants this,accept soft copy. And at the end of the lecture I feel like it was a waste of time, we didnt even get feedback on them andshe asks on the last lecture if she can use it for her research. Uhm did you ask us to do this for your research or for ourlearning or what?the amount of coursework is fairly distributedgoodOverall, I learned a lot in this course. Everything was interesting.The assignments provided a focus on the appendix aspect of the textbook. Due to this, I feel the assignments were notrelevant to key course material. Assignment rubrics were not clear and assignments were overly and unnecessarily complicated.The lectures and the activities in the lecture were very engaging and fun.ExcellentManage People & Grps in Orgs Organizational Behaviour-F-LEC03-Phanikiran Radhakrishnan-12/4/20174/16   8. Please comment on any assistance that was available to support your learning in thiscourse.'","b""Commentsassistance was goodProf was helpfulGreat support during her office hours!There was none.What support? All she always says is email me. I dont like emailing I want to talk face to face and not have to wait a dayfor a reply. So accessible hell yeah. Midterms were only pickable after the end of the course? And only on that one day?it's good that there are videos taken of all the classesgoodCommunicating with the professor and TAs during office hours and through emails.nsExcellentManage People & Grps in Orgs Organizational Behaviour-F-LEC03-Phanikiran Radhakrishnan-12/4/20175/16   """
Organizational Behaviour,UTSC,Fall_2017,LEC02,62,21,3.6,3.6,3.9,3.7,3.8,3.3,3.5,3.3,3.4,4,4,4,4,4,3,4,4,3,4,4,3,0.9,1,0.9,1,1,1,N/A,N/A,N/A,N/A,N/A,N/A,N/A,"b""When she's teaching all she does is read off her slides and they aren't very clear either. If not for the 5% participationmark I wouldn't even show up to class because again its just reading off slides I can do that at home. The groupactivities she does doesn't teach us anything either.Professor didn't teach all materials and the lecture notes aren't clear. She always end class early, most of material Ilearned is from textbook.\xe2\x80\x93The powerpoint presentations were confusing as it didn't match the lesson pace.It was good.lots of explanations and engagement, participation opportunities, interesting learning not just powerpoint notes butvideos and activitiesProfessor sometimes goes through the content too fast to the point that students don't retain the knowledge after class.But class activities are fun and help students understand conceptsThe instruction in this course could have been better, when it came to how the professor wanted us to do on the essayand group project she could have explained it better.It seemed like the course was often heavily focused on research for some reason. It was mainly following the textbook,however, we had several assignments based on research and things related to that which was not what I had hopedfor. Overall, the course had some great in\xe2\x80\x93class activities, however, compared to my other courses was the leastintellectually stimulating or interesting.Well instructed, sometimes too fast.Professor Radhakrishnan was amazing. I looked forward to attending every class. I appreciate the use of journals asthey help to prepare for final exams. Thank you, professor.Dr. P is brilliant and has a very good teaching style. love the way she incorporates the content of the course in how sheteaches as well. I think that goes very deep.8. Please comment on any assistance that was available to support your learning in thiscourse.""","b""CommentsMake better clear lecture notes and teach more stuff\xe2\x80\x93The prof was there if we had questions.too much work during the class that I could not concentrate on the lecture itselfread the textbookIn person office hours, virtual office hours, and email were availableThere should have been tutorials held for this course, it would have been very beneficial.Office hours, ta help.Various resources online, blackboard, the professor.Prof. P provided a lot of resources for every assessment. Greatly appreciated!I normally enjoy walking in to office hours but it's hard to pre book and attend so I failed to benefit from them.Manage People & Grps in Orgs Organizational Behaviour-F-LEC02-Phanikiran Radhakrishnan-12/4/20174/15   """
Leadership Skills,UTSC,Winter_2013,LEC01,[],[],3.6,3.6,3.9,3.7,3.8,3.3,3.5,3.3,3.4,N/A,N/A,N/A,N/A,N/A,N/A,N/A,N/A,N/A,N/A,N/A,N/A,N/A,N/A,N/A,N/A,N/A,N/A,N/A,N/A,N/A,N/A,N/A,N/A,N/A,"b'b""When she\'s teaching all she does is read off her slides and they aren\'t very clear either. If not for the 5% participationmark I wouldn\'t even show up to class because again its just reading off slides I can do that at home. The groupactivities she does doesn\'t teach us anything either.Professor didn\'t teach all materials and the lecture notes aren\'t clear. She always end class early, most of material Ilearned is from textbook.\\xe2\\x80\\x93The powerpoint presentations were confusing as it didn\'t match the lesson pace.It was good.lots of explanations and engagement, participation opportunities, interesting learning not just powerpoint notes butvideos and activitiesProfessor sometimes goes through the content too fast to the point that students don\'t retain the knowledge after class.But class activities are fun and help students understand conceptsThe instruction in this course could have been better, when it came to how the professor wanted us to do on the essayand group project she could have explained it better.It seemed like the course was often heavily focused on research for some reason. It was mainly following the textbook,however, we had several assignments based on research and things related to that which was not what I had hopedfor. Overall, the course had some great in\\xe2\\x80\\x93class activities, however, compared to my other courses was the leastintellectually stimulating or interesting.Well instructed, sometimes too fast.Professor Radhakrishnan was amazing. I looked forward to attending every class. I appreciate the use of journals asthey help to prepare for final exams. Thank you, professor.Dr. P is brilliant and has a very good teaching style. love the way she incorporates the content of the course in how sheteaches as well. I think that goes very deep.8. Please comment on any assistance that was available to support your learning in thiscourse.""'","b'b""CommentsMake better clear lecture notes and teach more stuff\\xe2\\x80\\x93The prof was there if we had questions.too much work during the class that I could not concentrate on the lecture itselfread the textbookIn person office hours, virtual office hours, and email were availableThere should have been tutorials held for this course, it would have been very beneficial.Office hours, ta help.Various resources online, blackboard, the professor.Prof. P provided a lot of resources for every assessment. Greatly appreciated!I normally enjoy walking in to office hours but it\'s hard to pre book and attend so I failed to benefit from them.Manage People & Grps in Orgs Organizational Behaviour-F-LEC02-Phanikiran Radhakrishnan-12/4/20174/15   ""'"
Leadership Skills,UTSC,Summer_2015,LEC01,40,10,2.5,2.7,2.3,2.6,2.8,2.2,2.5,3.5,2.2,2.5,2.5,2,2.5,2.5,2,"2,3",2,2,4,"2,4",1,1.1,1.1,1.1,1.3,1.1,1.3,N/A,N/A,N/A,N/A,N/A,N/A,N/A,"b'Engaging and interactiveVery thorough in teaching, however not a lot of flexibility in expressing a different opinion.Professor is clearly mining data for her own personal research. Even makes you sign a waiver. Very manipulative andnot interested in discussion due to her insistence to always be right.Lectures were acceptable but role playing felt awkward.8. Please comment on any assistance that was available to support your learning in thiscourse.'",b'CommentProfessorVery willing to help.Emails could be sent to the professor and questions can be asked during class. Some of these opportunities weretaken advantage of but the quality in helping my learning was not as good.'
Compensation,UTSC,Fall_2019,LEC01,13,5,2.4,2.2,2.8,2.4,2.6,2.6,2.6,2.8,2.6,2,2,2,2,2,2,2,1,2,2,"2,4","2,4",1.1,1.3,1.3,1.1,1.3,1.3,N/A,N/A,N/A,N/A,N/A,N/A,N/A,"b'Did not understand the purpose of some of the classes. prof tried to be clear , was very open to being helpful and looking out for thestudents, however did not understand her point when it came to class material sometimes. Could be more clear and direct whenexplaining class concepts.I learned new concepts about compensation and especially coding with data regression.I have no doubt that she is an excellent researcher but she definitely needs to work on her teaching skills if students are to succeedin her course. The material is very unclear and not well explained. She is a very approachable professor but she needs to improveher course material a great deal.8. Please comment on any assistance that was available to support your learning in this course.Comments'",b'The professor was available to assist with questions during class and the finance lab director was also helpful with RStudio.Textbook'
Leadership Skills,UTSC,Fall_2014,LEC03,40,9,3.9,3.9,4.6,3.9,3.7,3.7,3.7,3.2,3.7,4,4,5,4,4,4,4,4,5,4,"3,4","3,4",0.8,0.9,0.5,0.8,1,0.7,N/A,N/A,N/A,N/A,N/A,N/A,N/A,"b'She was available for any questions and described concepts clearlyI like that the professor used interactive methods to teach us leadership skills. This improved a few of my skills. I foundthe assignment instructions a bit vague compared to other courses, but she held office hours and a workshop to clarifyany concerns. Overall a very effective instructor8. Please comment on any assistance that was available to support your learning in thiscourse.'",b'CommentGreat'
Organizational Behaviour,UTSC,Fall_2015,LEC01,62,18,2.6,2.7,3.2,2.8,2.9,2.6,2.5,3.2,2.6,3,3,4,3,3,3,"1,4",1,4,"3,",3,"2,3",1.4,1.4,1.4,,1.3,1.2,N/A,N/A,N/A,N/A,N/A,N/A,N/A,"b'Poor explanation, useless material, feel like wasting my timeit makes you go out of your comfort zone, but the book and all the contents related to it are useless.The course material was pretty easy to understand and the textbook was not to bad of a read.The quality of this course is horrible. It is understandable to have the midterm as 25% and final as 30%. However,assignments with weights as large as 15%-25% is unreasonable; feedback is given at the end of assignments, but notapplicable to future assignments making it difficult for students trying their absolute best to improve. Assignments wereunreasonably marked and feels subjective. Students trying to improve find it difficult as the professor does not tellstudents of allocation weight of questions in the midterm/final. The average for assignments/exams is not said as theprofessor, repetitively telling students that ""it does not help you"".The material taught in this course was very interesting and applicable to the field of management. However, the way itwas taught in class and explained was poorly done. I feel that concepts were quickly explained and majority of the classwas group work. Although I can appreciate the group work and how it created discussions, I don\'t think this method wasthe best for all the material taught in class. I think this course needs some more structure and better explanations ofmaterials. It was only while studying for exams that I actually began to understand material and realise that the coursewas, in fact, interesting. The course projects were also extremely similar in nature which, I felt, didn\'t help myunderstanding of course materials at all. As management students who don\'t have a lot of experience with academicand scholarly studies, the course projects felt detatched from the course itself and unecessary. This course has a lot ofpotential, I think it just needs to be taught to students with better methods.8. Please comment on any assistance that was available to support your learning in thiscourse.'","b'Comment-Quick email responsepretty much memorization, so no assistance needednot necessaryMy peers and I studied together to better understand the concepts and this helped me gain more insight on the coursematerial.Lecture slides were difficult to interpret, the textbook for this course helps out more. Instructions for assignments wereunclear. Practicing content from the course is difficult to do as it must be confronted with the professor/TA in order for itto become an acceptable answer. At the same time, quality of feedback of the accepted answers is not insightful (sayfor an exam or assignment). Homework is given for most weeks, but it is not marked. In-class assignments are usuallygiven for attendance, again, it is not marked.'"
